{
  "id": "SP-003",
  "slug": "0802pattern-0031",
  "joomla_id": 190,
  "title": "Privacy Mobile Device Pattern",
  "description": "Security architecture and controls for mobile device privacy considerations",
  "url": "https://www.opensecurityarchitecture.org/library/patternlandscape/190-0802pattern-0031",
  "metadata": {
    "release": "08.02",
    "classification": "",
    "status": "published",
    "type": "pattern",
    "datePublished": "2008-02-02",
    "dateModified": "2025-07-04",
    "authors": [
      "Russell"
    ],
    "reviewers": []
  },
  "diagram": {
    "svg": "/images/OSA_images/patterns/08_02_02_Pattern_003_Privacy_Mobile_Device.svg",
    "png": "/images/OSA_images/patterns/08_02_02_Pattern_003_Privacy_Mobile_Device.png"
  },
  "content": {
    "description": "",
    "keyControlAreas": [],
    "assumptions": "",
    "typicalChallenges": "",
    "indications": "You are in a regulated industry that processes PII on mobile devices, or are subject to laws such as SB1386.<br/><br/>",
    "contraIndications": "You do not process any PII or other confidential information on mobile devices.<br/>",
    "threatResistance": ""
  },
  "references": [],
  "controls": [],
  "controlFamilySummary": {},
  "$schema": "../schema/pattern.schema.json"
}