{
  "id": "SP-009",
  "slug": "0802pattern009",
  "joomla_id": 236,
  "title": "Generic Pattern",
  "description": "Generic security pattern that shows how the major NIST control families apply to security architecture for generic computing environment",
  "url": "https://www.opensecurityarchitecture.org/library/patternlandscape/236-0802pattern009",
  "metadata": {
    "release": "08.02",
    "classification": "",
    "status": "published",
    "type": "pattern",
    "datePublished": "2008-10-16",
    "dateModified": "2025-07-05",
    "authors": [
      "Spinoza"
    ],
    "reviewers": []
  },
  "diagram": {
    "svg": "/images/OSA_images/patterns/08_02_Pattern_009_02_Generic.svg",
    "png": "/images/OSA_images/patterns/08_02_Pattern_009_02_Generic.png"
  },
  "content": {
    "description": "",
    "keyControlAreas": [],
    "assumptions": "All computing systems are accessed from some form of user interface to a client. The client can connect to resources provided by a host across some form of network. Hosts can act as clients and servers to communicate. This model echoes the original design goals of TCP/IP where the intelligence is placed into the end point, and application layer of the network stack, and the network simply transfers data packets.<br/><br/>",
    "typicalChallenges": "not applicable.<br/><br/>",
    "indications": "not applicable.<br/><br/>",
    "contraIndications": "not applicable.<br/><br/>",
    "threatResistance": "not applicable.<br/><br/>"
  },
  "references": [],
  "controls": [],
  "controlFamilySummary": {},
  "$schema": "../schema/pattern.schema.json"
}