{
  "id": "SP-999",
  "slug": "svg-test",
  "joomla_id": 194,
  "title": "SVG Test",
  "description": "OpenSecurityArchitecture (OSA) distills the know-how of the security architecture community and provides readily usable patterns for your application. This is a free framework, developed and owned by the community.",
  "url": "https://www.opensecurityarchitecture.org/library/patternlandscape/194-0802pattern-svg-test",
  "metadata": {
    "release": "08.02",
    "classification": "",
    "status": "published",
    "type": "pattern",
    "datePublished": "2008-01-30",
    "dateModified": "2025-07-06",
    "authors": [
      "Russell"
    ],
    "reviewers": []
  },
  "diagram": {
    "svg": "/images/patterns/08_02_06_Pattern_000_Template.svg",
    "png": "/images/OSA_images/patterns/08_02_06_Pattern_000_Template.png"
  },
  "content": {
    "description": "",
    "keyControlAreas": [],
    "assumptions": "",
    "typicalChallenges": "",
    "indications": "",
    "contraIndications": "",
    "threatResistance": ""
  },
  "references": [],
  "controls": [],
  "controlFamilySummary": {},
  "$schema": "../schema/pattern.schema.json"
}
