{
  "id": "SP-012",
  "slug": "reserved-sp-012-secure-sdlc-pattern",
  "joomla_id": 287,
  "title": "Secure SDLC Pattern  (RESERVED for development)",
  "description": "OpenSecurityArchitecture (OSA) distills the know-how of the security architecture community and provides readily usable patterns for your application. This is a free framework, developed and owned by the community.",
  "url": "https://www.opensecurityarchitecture.org/library/patternlandscape/287-reserved-sp-012-secure-sdlc-pattern",
  "metadata": {
    "release": "08.02",
    "classification": "",
    "status": "reserved",
    "type": "pattern",
    "datePublished": "2010-07-31",
    "dateModified": "2025-07-05",
    "authors": [
      "Russell"
    ],
    "reviewers": []
  },
  "content": {
    "description": "",
    "keyControlAreas": [],
    "assumptions": "",
    "typicalChallenges": "",
    "indications": "",
    "contraIndications": "",
    "threatResistance": ""
  },
  "references": [],
  "controls": [],
  "controlFamilySummary": {},
  "$schema": "../schema/pattern.schema.json"
}